{
  "protocol_version": 2,
  "scope": "session",
  "session_id": "sess-design-01",
  "revision": 42,
  "conversation_revision": 42,
  "generation_id": "gen-20260724-0007",
  "captured_at": "2026-07-24T09:31:12Z",
  "conversation": [
    {
      "message_id": "msg-103",
      "role": "user",
      "content": "Review the generation boundary.",
      "created_at": "2026-07-24T09:30:50Z"
    },
    {
      "message_id": "msg-104",
      "role": "assistant",
      "content": "Generation committed.",
      "created_at": "2026-07-24T09:31:12Z",
      "card_id": "card-review-01"
    }
  ],
  "history": {
    "has_more": true,
    "next_cursor": "eyJ2IjoyLCJyZXYiOjQyfQ"
  },
  "chat": {
    "lifecycle": "running",
    "request_id": "req-01J3M6N9",
    "queued_count": 0
  },
  "runtime": {
    "model": "example-model",
    "provider": "example-provider",
    "plugin": "default",
    "effort": "high",
    "workspace_id": "ws-seelex"
  }
}
